UID,title,authors,abstract,slideslive_id,slideslive_active_date,doi_link
P16,Learning to Safely Approve Updates to Machine Learning Algorithms,"Jean Feng (University of California, San Francisco)","Machine learning algorithms in healthcare have the potential to continually learn from real-world data generated during healthcare delivery and adapt to dataset shifts. As such, regulatory bodies like the US FDA have begun discussions on how to autonomously approve modifications to algorithms. Current proposals evaluate algorithmic modifications via hypothesis testing. However, these methods are only able to define and control the online error rate if the data is stationary over time, which is unlikely to hold in practice. In this manuscript, we investigate designing approval policies for modifications to ML algorithms in the presence of distributional shifts. Our key observation is that the approval policy that is most efficient at identifying and approving beneficial modifications varies across different problem settings. So rather than selecting fixed approval policy a priori, we propose learning the best approval policy by searching over a family of approval strategies. We define a family of strategies that range in their level of optimism when approving modifications. This family includes the pessimistic strategy that, in fact, rescinds approval, which is necessary when no version of the ML algorithm performs well. We use the exponentially weighted averaging forecaster (EWAF) to learn the most appropriate strategy and derive tighter regret bounds assuming the distributional shifts are bounded. In simulation studies and empirical analyses, we find that wrapping approval strategies within EWAF algorithm is a simple yet effective strategy that can help protect against distributional shifts without significantly slowing down approval of beneficial modifications.",38954737,2021-04-14T23:59:00.00,https://doi.org/10.1145/3450439.3451864
P17,iGOS++: Integrated Gradient Optimized Saliency by Bilateral Perturbations,"Saeed Khorram, Tyler Lawson, and Fuxin Li (Oregon State University)","The black-box nature of the deep networks makes the explanation for ""why"" they make certain predictions extremely challenging. Saliency maps are one of the most widely-used local explanation tools to alleviate this problem. One of the primary approaches for generating saliency maps is by optimizing a mask over the input dimensions so that the output of the network is influenced the most by the masking. However, prior work only studies such influence by removing evidence from the input. In this paper, we present iGOS++, a framework to generate saliency maps that are optimized for altering the output of the black-box system by either removing or preserving only a small fraction of the input. Additionally, we propose to add a bilateral total variation term to the optimization that improves the continuity of the saliency map especially under high resolution and with thin object parts. The evaluation results from comparing iGOS++ against state-of-the-art saliency map methods show significant improvement in locating salient regions that are directly interpretable by humans. We utilized iGOS++ in the task of classifying COVID-19 cases from x-ray images and discovered that sometimes the CNN network is overfitted to the characters printed on the x-ray images when performing classification. Fixing this issue by data cleansing significantly improved the precision and recall of the classifier.",38954738,2021-04-14T23:59:00.00,https://doi.org/10.1145/3450439.3451865
P18,Phenotypical Ontology Driven Framework for Multi-Task Learning,"Mohamed Ghalwash, Zijun Yao, Prithwish Chakraborty, james Codella, and Daby Sow (IBM Research)","Despite the large number of patients in Electronic Health Records (EHRs), the subset of usable data for modeling outcomes of specific phenotypes are often imbalanced and of modest size. This can be attributed to the uneven coverage of medical concepts in EHRs. We propose OMTL, an Ontology-driven Multi-Task Learning framework, that is designed to overcome such data limitations.The key contribution of our work is the effective use of knowledge from a predefined well-established medical relationship graph (ontology) to construct a novel deep learning network architecture that mirrors this ontology. This enables common representations to be shared across related phenotypes, and was found to improve the learning performance. The proposed OMTL naturally allows for multi-task learning of different phenotypes on distinct predictive tasks. These phenotypes are tied together by their semantic relationship according to the external medical ontology. Using the publicly available MIMIC-III database, we evaluate OMTL and demonstrate its efficacy on several real patient outcome predictions over state-of-the-art multi-task learning schemes. The results of evaluating the proposed approach on six experiments show improvement in the area under ROC curve by 9\% and by 8\% in the area under precision-recall curve.",38954748,2021-04-14T23:59:00.00,https://doi.org/10.1145/3450439.3451881
P19,RNA Alternative Splicing Prediction with Discrete Compositional Energy Network,"Alvin Chan, Anna Korsakova, Yew-Soon Ong, Fernaldo Richtia Winnerdy, Kah Wai Lim, and Anh Tuan Phan (Nanyang Technological University)","A single gene can encode for different protein versions through a process called alternative splicing. Since proteins play major roles in cellular functions, aberrant splicing profiles can result in a variety of diseases, including cancers. Alternative splicing is determined by the gene's primary sequence and other regulatory factors such as RNA-binding protein levels. With these as input, we formulate the prediction of RNA splicing as a regression task and build a new training dataset (CAPD) to benchmark learned models. We propose discrete compositional energy network (DCEN) which leverages the hierarchical relationships between splice sites, junctions and transcripts to approach this task. In the case of alternative splicing prediction, DCEN models mRNA transcript probabilities through its constituent splice junctions' energy values. These transcript probabilities are subsequently mapped to relative abundance values of key nucleotides and trained with ground-truth experimental measurements. Through our experiments on CAPD, we show that DCEN outperforms baselines and ablation variants.",38954739,2021-04-14T23:59:00.00,https://doi.org/10.1145/3450439.3451857
P20,Predictive Models for Colorectal Cancer Recurrence Using Multi-modal Healthcare Data,Danliang Ho (National University of Singapore) | Iain Bee Huat Tan (National Cancer Center Singapore) | Mehul Motani (National University of Singapore),"Colorectal cancer recurrence is a major clinical problem - around 30-40% of patients who are treated with curative intent surgery will experience cancer relapse. Proactive prognostication is critical for early detection and treatment of recurrence. However, the common clinical approach to monitoring recurrence through testing for carcinoembryonic antigen (CEA) does not possess a strong prognostic performance. In our paper, we study a series of machine and deep learning architectures that exploit heterogeneous healthcare data to predict colorectal cancer recurrence. In particular, we demonstrate three different approaches to extract and integrate features from multiple modalities including longitudinal as well as tabular clinical data. Our best model employs a hybrid architecture that takes in multi-modal inputs and comprises: 1) a Transformer model carefully modified to extract high-quality features from time-series data, and 2) a Multi-Layered Perceptron (MLP) that learns tabular data features, followed by feature integration and classification for prediction of recurrence. It achieves an AUROC score of 0.95, as well as precision, sensitivity and specificity scores of 0.83, 0.80 and 0.96 respectively, surpassing the performance of all-known published results based on CEA, as well as most commercially available diagnostic assays. Our results could lead to better post-operative management and follow-up of colorectal cancer patients.",38954740,2021-04-14T23:59:00.00,https://doi.org/10.1145/3450439.3451868
P21,B-SegNet : Branched-SegMentor Network For Skin Lesion Segmentation,"shreshth saini (indian institute of technology jodhpur) | Jeon Young Seok and Mengling Feng (Saw Swee Hock School of PublicHealth, National University HealthSystem, National University ofSingapore)","Melanoma is the most common form of cancer in the world. Early diagnosis of the disease and an accurate estimation of its size and shape are crucial in preventing its spread to other body parts. Manual segmentation of these lesions by a radiologist however is time consuming and error-prone. It is clinically desirable to have an automatic tool to detect malignant skin lesions from dermoscopic skin images. We propose a novel end-to-end convolution neural network(CNN) for a precise and robust skin lesion localization and segmentation. The proposed network has 3 sub-encoders branching out from the main encoder. The 3 sub-encoders are inspired from Coordinate Convolution, Hourglass, and Octave Convolutional blocks: each sub-encoder summarizes different patterns and yet collectively aims to achieve a precise segmentation. We trained our segmentation model just on the ISIC 2018 dataset. To demonstrate the generalizability of our model, we evaluated our model on the ISIC 2018 and unseen datasets including ISIC 2017 and PH$^2$. Our approach showed an average 5\% improvement in performance over different datasets while having less than half of the number of parameters when compared to other state-of-the-art segmentation models.",38954741,2021-04-14T23:59:00.00,https://doi.org/10.1145/3450439.3451873
P22,Modeling Longitudinal Dynamics of Comorbidities,"Basil Maag, Stefan Feuerriegel, and Mathias Kraus (ETH Zurich) | Maytal Saar-Tsechansky (University of Texas at Austin) | Thomas Zueger (1) Inselspital, Bern, University Hospital, University of Bern 2) ETH Zurich)","In medicine, comorbidities refer to the presence of multiple, co-occurring diseases. Due to their co-occurring nature, the course of one comorbidity is often highly dependent on the course of the other disease and, hence, treatments can have significant spill-over effects. Despite the prevalence of comorbidities among patients, a comprehensive statistical framework for modeling the longitudinal dynamics of comorbidities is missing. In this paper, we propose a probabilistic model for analyzing comorbidity dynamics over time in patients. Specifically, we develop a coupled hidden Markov model with a personalized, non-homogeneous transition mechanism, named Comorbidity-HMM. The specification of our Comorbidity-HMM is informed by clinical research: (1) It accounts for different disease states (i. e., acute, stable) in the disease progression by introducing latent states that are of clinical meaning. (2) It models a coupling among the trajectories from comorbidities to capture co-evolution dynamics. (3) It considers between-patient heterogeneity (e. g., risk factors, treatments) in the transition mechanism. Based on our model, we define a spill-over effect that measures the indirect effect of treatments on patient trajectories through coupling (i. e., through comorbidity co-evolution). We evaluated our proposed Comorbidity-HMM based on 675 health trajectories where we investigate the joint progression of diabetes mellitus and chronic liver disease. Compared to alternative models without coupling, we find that our Comorbidity-HMM achieves a superior fit. Further, we quantify the spill-over effect, that is, to what extent diabetes treatments are associated with a change in the chronic liver disease from an acute to a stable disease state. To this end, our model is of direct relevance for both treatment planning and clinical research in the context of comorbidities.",38954742,2021-04-14T23:59:00.00,https://doi.org/10.1145/3450439.3451871
P23,T-DPSOM - An Interpretable Clustering Method for Unsupervised Learning of Patient Health States,"Laura Manduchi, Matthias Hüser, Martin Faltys, Julia Vogt, Gunnar Rätsch, and Vincent Fortuin (ETH Zürich)","Generating interpretable visualizations of multivariate time series in the intensive care unit is of great practical importance. Clinicians seek to condense complex clinical observations into intuitively understandable critical illness patterns, like failures of different organ systems. They would greatly benefit from a low-dimensional representation in which the trajectories of the patients' pathology become apparent and relevant health features are highlighted. To this end, we propose to use the latent topological structure of Self-Organizing Maps (SOMs) to achieve an interpretable latent representation of ICU time series and combine it with recent advances in deep clustering. Specifically, we (a) present a novel way to fit SOMs with probabilistic cluster assignments (PSOM), (b) propose a new deep architecture for probabilistic clustering (DPSOM) using a VAE, and (c) extend our architecture to cluster and forecast clinical states in time series (T-DPSOM). We show that our model achieves superior clustering performance compared to state-of-the-art SOM-based clustering methods while maintaining the favorable visualization properties of SOMs. On the eICU data-set, we demonstrate that T-DPSOM provides interpretable visualizations of patient state trajectories and uncertainty estimation. We show that our method rediscovers well-known clinical patient characteristics, such as a dynamic variant of the Acute Physiology And Chronic Health Evaluation (APACHE) score. Moreover, we illustrate how it can disentangle individual organ dysfunctions on disjoint regions of the two-dimensional SOM map.",38954743,2021-04-14T23:59:00.00,https://doi.org/10.1145/3450439.3451872
P24,Contextualization and Individualization for Just-in-Time Adaptive Interventions to Reduce Sedentary Behavior,"Matthew Saponaro, Ajith Vemuri, Greg Dominick, and Keith Decker (University of Delaware)","Wearable technology opens opportunities to reduce sedentary behavior; however, commercially available devices do not provide tailored coaching strategies. Just-In-Time Adaptive Interventions (JITAI) provide such a framework; however most JITAI are conceptual to date. We conduct a study to evaluate just-in-time nudges in free-living conditions in terms of receptiveness and nudge impact. We first quantify baseline behavioral patterns in context using features such as location and step count, and assess differences in individual responses. We show there is a strong inverse relationship between average daily step counts and time spent being sedentary indicating that steps are steadily taken throughout the day, rather than in large bursts. Interestingly, the effect of nudges delivered at the workplace is larger in terms of step count than those delivered at home. We develop Random Forest models to learn nudge receptiveness using both individualized and contextualized data. We show that step count is the least important identifier in nudge receptiveness, while location is the most important. Furthermore, we compare the developed models with a commercially available smart coach using post-hoc analysis. The results show that using the contextualized and individualized information significantly outperforms non-JITAI approaches to determine nudge receptiveness.",38954744,2021-04-14T23:59:00.00,https://doi.org/10.1145/3450439.3451874
P25,A Comprehensive EHR Timeseries Pre-training Benchmark,"Matthew McDermott (Massachusetts Institute of Technology) | Bret Nestor (University of Toronto) | Evan Kim (Massachusetts Institute of Technology) | Wancong Zhang (New York University) | Anna Goldenberg (Hospital for Sick Children, University of Toronto, Vector Institute) | Peter Szolovits (MIT) | Marzyeh Ghassemi (University of Toronto | Vector Institute for Artificial Intelligence)","Pre-training (PT) has been used successfully in many areas of machine learning. One area where PT would be extremely impactful is over electronic health record (EHR) data. Successful PT strategies on this modality could improve model performance in data-scarce contexts such as modeling for rare diseases or allowing smaller hospitals to benefit from data from larger health systems. While many PT strategies have been explored in other domains, much less exploration has occurred for EHR data. One reason this may be is the lack of standardized benchmarks suitable for developing and testing PT algorithms. In this work, we establish a PT benchmark dataset for EHR timeseries data, establishing cohorts, a diverse set of fine-tuning tasks, and PT-focused evaluation regimes across two public EHR datasets: MIMIC-III and eICU. This benchmark fills an essential hole in the field by enabling a robust manner of iterating on PT strategies for this modality. To show the value of this benchmark and provide baselines for further research, we also profile two simple PT algorithms: a self-supervised, masked imputation system and a weakly-supervised, multi-task system. We find that PT strategies (in particular weakly-supervised PT methods) can offer significant gains over traditional learning in few-shot settings, especially on tasks with strong class imbalance. Our full benchmark and code are publicly available at REDACTED FOR REVIEW.",38954745,2021-04-14T23:59:00.00,https://doi.org/10.1145/3450439.3451877
P26,An Empirical Framework for Domain Generalization In Clinical Settings,"Haoran Zhang (University of Toronto | Vector Institute) | Natalie Dullerud (University of Toronto, Vector Institute) | Laleh Seyyed-Kalantari (University of Toronto) | Quaid Morris (Memorial Sloan Kettering Cancer Center) | Shalmali Joshi (Harvard University) | Marzyeh Ghassemi (University of Toronto | Vector Institute for Artificial Intelligence)","Clinical machine learning models have been found to significantly degrade in performance on hospitals or regions not seen during training. Recent developments in domain generalization offer a promising solution to this problem, by creating models that learn invariances which hold across environments. In this work, we benchmark the performance of eight domain generalization methods on clinical time series and medical imaging data. We introduce a framework to induce practical confounding and sampling bias to stress-test these methods over existing non-healthcare benchmarks. We find, consistent with prior work, that current domain generalization methods do not achieve significant gains in out-of-distribution performance over empirical risk minimization on real-world medical imaging data. However, we do find a subset of realistic confounding scenarios where significant performance gains are observed. We characterize these scenarios in detail, and recommend best practices for domain generalization in the clinical setting.",38954746,2021-04-14T23:59:00.00,https://doi.org/10.1145/3450439.3451878
P27,Influenza-like Symptom Recognition using Mobile Sensing and Graph Neural Networks,"Guimin Dong, Lihua Cai, Debajyoti Datta, Shashwat Kumar, Laura E. Barnes, and Mehdi Boukhechba (University of Virginia)","Early detection of influenza-like symptoms can prevent widespread flu viruses and enable timely treatments, particularly in the post-pandemic era. Mobile sensing leverages an increasingly diverse set of embedded sensors to capture fine-grained information of human behaviors and ambient contexts and can serve as a promising solution for influenza-like symptom recognition. Traditionally, handcrafted and high level features of mobile sensing data are extracted by using handcrafted feature engineering and Convolutional/Recurrent Neural Network respectively. However, in this work, we use graph representation to encode the dynamics of state transitions and internal dependencies in human behaviors, apply graph embeddings to automatically extract the topological and spatial features from graph input and propose an end-to-end Graph Neural Network model with multi-channel mobile sensing input for influenza-like symptom recognition based on people's daily mobility, social interactions, and physical activities. Using data generated from 448 participants, We show that Graph Neural Networks (GNN) with GraphSAGE convolutional layers significantly outperform baseline models with handcrafted features. Furthermore, we use GNN interpretability method to generate insight (important node, graph structure) for the symptom recognition. To the best of our knowledge, this is the first work that applies graph representation and graph neural network on mobile sensing data for graph-based human behaviors modeling.",38954747,2021-04-14T23:59:00.00,https://doi.org/10.1145/3450439.3451880
