UID,title,authors,abstract,slideslive_id,slideslive_active_date,doi_link
P01,Variationally Regularized Graph-based Representation Learning for Electronic Health Records,Weicheng Zhu (New York University) | Narges Razavian (NYU Grossman School of Medicine),"Electronic Health Records (EHR) are high-dimensional data with implicit connections among thousands of medical concepts. These connections, for instance, the co-occurrence of diseases and lab-disease correlations can be informative when only a subset of these variables is documented by the clinician. A feasible approach to improving the representation learning of EHR data is to associate relevant medical concepts and utilize these connections. Existing medical ontologies can be the reference for EHR structures, but they place numerous constraints on the data source. Recent progress on graph neural networks (GNN) enables end-to-end learning of topological structures for non-grid or non-sequential data. However, there are problems to be addressed on how to learn the medical graph adaptively and how to understand the effect of the medical graph on representation learning. In this paper, we propose a variationally regularized encoder-decoder graph network that achieves more robustness in graph structure learning by regularizing node representations. Our model outperforms the existing graph and non-graph based methods in various EHR predictive tasks based on both public data and real-world clinical data. Besides the improvements in empirical experiment performances, we provide an interpretation of the effect of variational regularization compared to standard graph neural network, using singular value analysis.",38954722,2021-04-14T23:59:00.00,https://doi.org/10.1145/3450439.3451855
P02,Affinitention Nets: Kernel Perspective on Attention Architectures for Set Classification with Applications to Medical Text and Images,"David Dov, Serge Assaad, Shijing Si, and Rui Wang (Duke University) | Hongteng Xu (Renmin University of China) | Shahar Ziv Kovalsky (UNC at Chapel Hill) | Jonathan Bell and Danielle Elliott Range (Duke University Hospital) | Jonathan Cohen (Kaplan Medical Center) | Ricardo Henao and Lawrence Carin (Duke University)","Set classification is the task of predicting a single label from a set comprising multiple instances. The examples we consider are pathology slides represented by sets of patches and medical text represented by sets of word embeddings. State of the art methods, such as the transformers, typically use attention mechanisms to learn representations of set-data by modeling interactions between instances of the set. These methods, however, have complex heuristic architectures comprising multiple heads and layers. The complexity of attention architectures hampers their training when only a small number of labeled sets is available, as is often the case in medical applications. To address this problem, we present a kernel-based representation learning framework that associates between learning affinity kernels to learning representations from attention architectures. We show that learning a combination of the sum and the product of kernels is equivalent to learning representations from multi-head multi-layer attention architectures. From our framework, we devise a simplified attention architecture which we term \emph{affinitention} (affinity-attention) nets. We demonstrate the application of affinitention nets to the classification of Set-Cifar10 dataset, thyroid malignancy prediction from pathology slides, as well as patient text message-triage. We show that affinitention nets provide competitive results compared to heuristic attention architectures and outperform other competing methods.",38954723,2021-04-14T23:59:00.00,https://doi.org/10.1145/3450439.3451856
P03,Privacy-Preserving and Bandwidth-Efficient Federated Learning: An Application to In-Hospital Mortality Prediction,"Raouf Kerkouche (Privatics team, Univ. Grenoble Alpes, Inria, 38000 Grenoble, France) | Gergely Ács (Crysys Lab, BME-HIT) | Claude Castelluccia (Privatics team, Univ. Grenoble Alpes, Inria, 38000 Grenoble, France) | Pierre Genevès (Tyrex team Univ. Grenoble Alpes, CNRS, Inria, Grenoble INP, LIG 38000 Grenoble, France)","Machine Learning, and in particular Federated Machine Learning, opens new perspectives in terms of medical research and patient care. Although Federated Machine Learning improves over centralized Machine Learning in terms of privacy, it does not provide provable privacy guarantees. Furthermore, Federated Machine Learning is quite expensive in term of bandwidth consumption as it requires participant nodes to regularly exchange large updates. This paper proposes a bandwidth-efficient privacy-preserving Federated Learning that provides theoretical privacy guarantees based on Differential Privacy. We experimentally evaluate our proposal for in-hospital mortality prediction using a real dataset, containing Electronic Health Records of about one million patients. Our results suggest that strong and provable patient-level privacy can be enforced at the expense of only a moderate loss of prediction accuracy.",38954724,2021-04-14T23:59:00.00,https://doi.org/10.1145/3450439.3451859
P04,Concept-based Model Explanations for Electronic Health Records,"Diana Mincu (Google Research) | Eric Loreaux (Google Health) | Shaobo Hou (DeepMind) | Sebastien Baur, Ivan Protsyuk, and Martin G Seneviratne (Google Health) | Anne Mottram and Nenad Tomasev (DeepMind) | Alan Karthikesalingam (Google Health) | Jessica Schrouff (Google Research)","Recurrent Neural Networks (RNNs) are often used for sequential modeling of adverse outcomes in electronic health records (EHRs) due to their ability to encode past clinical states. These deep, recurrent architectures have displayed increased performance compared to other modeling approaches in a number of tasks, fueling the interest in deploying deep models in clinical settings. One of the key elements in ensuring safe model deployment and building user trust is model explainability. Testing with Concept Activation Vectors (TCAV) has recently been introduced as a way of providing human-understandable explanations by comparing high-level concepts to the network's gradients. While the technique has shown promising results in real-world imaging applications, it has not been applied to structured temporal inputs. To enable an application of TCAV to sequential predictions in the EHR, we propose an extension of the method to time series data. We evaluate the proposed approach on an open EHR benchmark from the intensive care unit, as well as synthetic data where we are able to better isolate individual effects.",38954725,2021-04-14T23:59:00.00,https://doi.org/10.1145/3450439.3451858
P05,Trustworthy Machine Learning for Health Care: Scalable Data Valuation with the Shapley Value,"Konstantin D Pandl, Fabian Feiland, Scott Thiebes, and Ali Sunyaev (Karlsruhe Institute of Technology)","Sharing data is critical to generate large data sets required for the training of machine learning models. Trustworthy machine learning requires incentives, guarantees of data quality, and information privacy. Applying recent advancements in data valuation methods for machine learning can help to enable these. In this work, we analyze the suitability of three different data valuation methods for medical image classification tasks, specifically pleural effusion, on an extensive data set of chest x-ray scans. Our results reveal that a heuristic for calculating the Shapley valuation scheme based on a k-nearest neighbor classifier can successfully value large quantities of data instances. We also demonstrate possible applications for incentivizing data sharing, the efficient detection of mislabeled data, and summarizing data sets to exclude private information. Thereby, this work contributes to developing modern data infrastructures for trustworthy machine learning in health care.",38954726,2021-04-14T23:59:00.00,https://doi.org/10.1145/3450439.3451861
P06,Temporal Pointwise Convolutional Networks for Length of Stay Prediction in the Intensive Care Unit,Emma Rocheteau and Pietro Liò (University of Cambridge) | Stephanie Hyland (Microsoft Research),"The pressure of ever-increasing patient demand and budget restrictions make hospital bed management a daily challenge for clinical staff. Most critical is the efficient allocation of resource-heavy Intensive Care Unit (ICU) beds to the patients who need life support. Central to solving this problem is knowing for how long the current set of ICU patients are likely to stay in the unit. In this work, we propose a new deep learning model based on the combination of temporal convolution and pointwise (1x1) convolution, to solve the length of stay prediction task on the eICU and MIMIC-IV critical care datasets. The model - which we refer to as Temporal Pointwise Convolution (TPC) - is specifically designed to mitigate common challenges with Electronic Health Records, such as skewness, irregular sampling and missing data. In doing so, we have achieved significant performance benefits of 18-68% (metric and dataset dependent) over the commonly used Long-Short Term Memory (LSTM) network, and the multi-head self-attention network known as the Transformer. By adding mortality prediction as a side-task, we can improve performance further still, resulting in a mean absolute deviation of 1.55 days (eICU) and 2.28 days (MIMIC-IV) on predicting remaining length of stay.",38954727,2021-04-14T23:59:00.00,https://doi.org/10.1145/3450439.3451860
P07,Self-supervised Transfer Learning of Physiological Representations from Free-living Wearable Data,"Dimitris Spathis, Ignacio Pozuelo, Soren Brage, Nicholas J. Wareham, and Cecilia Mascolo (University of Cambridge)","Wearable devices such as smartwatches are becoming increasingly popular tools for objectively monitoring physical activity in free-living conditions. To date, research has primarily focused on the purely supervised task of human activity recognition, demonstrating limited success in inferring high-level health outcomes from low-level signals. Here, we present a novel _self-supervised_ representation learning method using activity and heart rate (HR) signals without semantic labels. With a deep neural network, we set HR responses as the _supervisory signal_ for the activity data, leveraging their underlying physiological relationship. In addition, we propose a custom quantile loss function that accounts for the long-tailed HR distribution present in the general population. We evaluate our model in the largest free-living combined-sensing dataset (comprising >280k hours of wrist accelerometer & wearable ECG data). Our contributions are two-fold: i) the pre-training task creates a model that can accurately forecast HR based only on cheap activity sensors, and ii) we leverage the information captured through this task by proposing a simple method to aggregate the learnt latent representations (embeddings) from the window-level to user-level. Notably, we show that the embeddings can generalize in various downstream tasks through transfer learning with linear classifiers, capturing physiologically meaningful, personalized information. For instance, they can be used to predict variables associated with individuals' health, fitness and demographic characteristics (AUC >70), outperforming unsupervised autoencoders and common bio-markers. Overall, we propose the first multimodal self-supervised method for behavioral and physiological data with implications for large-scale health and lifestyle monitoring.",38954728,2021-04-14T23:59:00.00,https://doi.org/10.1145/3450439.3451863
P08,Generative ODE Modeling with Known Unknowns,"Ori Linial and Neta Ravid (Technion) | Danny Eytan (Technion, Rambam) | Uri Shalit (Technion)","In several crucial applications, domain knowledge is encoded by a system of ordinary differential equations (ODE), often stemming from underlying physical and biological processes. A motivating example is intensive care unit patients: the dynamics of vital physiological functions, such as the cardiovascular system with its associated variables (heart rate, cardiac contractility and output and vascular resistance) can be approximately described by a known system of ODEs. Typically, some of the ODE variables are directly observed (heart rate and blood pressure for example) while some are unobserved (cardiac contractility, output and vascular resistance), and in addition many other variables are observed but not modeled by the ODE, for example body temperature. Importantly, the unobserved ODE variables are ``known-unknowns'': We know they exist and their functional dynamics, but cannot measure them directly, nor do we know the function tying them to all observed measurements. As is often the case in medicine, and specifically the cardiovascular system, estimating these known-unknowns is highly valuable and they serve as targets for therapeutic manipulations. Under this scenario we wish to learn the parameters of the ODE generating each observed time-series, and extrapolate the future of the ODE variables and the observations. We address this task with a variational autoencoder incorporating the known ODE function, called GOKU-net for Generative ODE modeling with Known Unknowns. We first validate our method on videos of single and double pendulums with unknown length or mass; we then apply it to a model of the cardiovascular system. We show that modeling the known-unknowns allows us to successfully discover clinically meaningful unobserved system parameters, leads to much better extrapolation, and enables learning using much smaller training sets.",38954729,2021-04-14T23:59:00.00,https://doi.org/10.1145/3450439.3451866
P09,Learning to Predict with Supporting Evidence: Applications to Clinical Risk Prediction,Aniruddh Raghu and John Guttag (Massachusetts Institute of Technology) | Katherine Young (Harvard Medical School) | Eugene Pomerantsev (Massachusetts General Hospital) | Adrian V. Dalca (Harvard Medical School & MIT) | Collin M. Stultz (Massachusetts Institute of Technology),"The impact of machine learning models on healthcare will depend on the degree of trust that healthcare professionals place in the predictions made by these models. In this paper, we present a method to provide people with clinical expertise with domain-relevant evidence about why a prediction should be trusted. We first design a probabilistic model that relates meaningful latent concepts to prediction targets and observed data. Inference of latent variables in this model corresponds to both making a prediction $\textit{and}$ providing supporting evidence for that prediction. We present a two-step process to efficiently approximate inference: (i) estimating model parameters using variational learning, and (ii) approximating $\textit{maximum a posteriori}$ estimation of latent variables in the model using a neural network trained with an objective derived from the probabilistic model. We demonstrate the method on the task of predicting mortality risk for cardiovascular patients. Specifically, using electrocardiogram and tabular data as input, we show that our approach provides appropriate domain-relevant supporting evidence for accurate predictions.",38954730,2021-04-14T23:59:00.00,https://doi.org/10.1145/3450439.3451869
P10,VisualCheXbert: Addressing the Discrepancy Between Radiology Report Labels and Image Labels,"Saahil Jain and Akshay Smit (Stanford University) | Steven QH Truong, Chanh DT Nguyen, and Minh-Thanh Huynh (VinBrain) | Mudit Jain (unaffiliated) | Victoria A. Young, Andrew Y. Ng, Matthew P. Lungren, and Pranav Rajpurkar (Stanford University)","Automatic extraction of medical conditions from free-text radiology reports is critical for supervising computer vision models to interpret medical images. In this work, we show that radiologists labeling reports significantly disagree with radiologists labeling corresponding chest X-ray images, which reduces the quality of report labels as proxies for image labels. We develop and evaluate methods to produce labels from radiology reports that have better agreement with radiologists labeling images. Our best performing method, called VisualCheXbert, uses a biomedically-pretrained BERT model to directly map from a radiology report to the image labels, with a supervisory signal determined by a computer vision model trained to detect medical conditions from chest X-ray images. We find that VisualCheXbert outperforms an approach using an existing radiology report labeler by an average F1 score of 0.14 (95% CI 0.12, 0.17). We also find that VisualCheXbert better agrees with radiologists labeling chest X-ray images than do radiologists labeling the corresponding radiology reports by an average F1 score across several medical conditions of between 0.12 (95% CI 0.09, 0.15) and 0.21 (95% CI 0.18, 0.24).",38954731,2021-04-14T23:59:00.00,https://doi.org/10.1145/3450439.3451862
P11,CheXtransfer: Performance and Parameter Efficiency of ImageNet Models for Chest X-Ray Interpretation,"Alexander Ke, William Ellsworth, Oishi Banerjee, Andrew Y. Ng, and Pranav Rajpurkar (Stanford University)","Deep learning methods for chest X-ray interpretation typically rely on pretrained models developed for ImageNet. This paradigm assumes that better ImageNet architectures perform better on chest X-ray tasks and that ImageNet-pretrained weights provide a performance boost over random initialization. In this work, we compare the transfer performance and parameter efficiency of 16 popular convolutional architectures on a large chest X-ray dataset (CheXpert) to investigate these assumptions. First, we find no relationship between ImageNet performance and CheXpert performance for both models without pretraining and models with pretraining. Second, we find that, for models without pretraining, the choice of model family influences performance more than size within a family for medical imaging tasks. Third, we observe that ImageNet pretraining yields a statistically significant boost in performance across architectures, with a higher boost for smaller architectures. Fourth, we examine whether ImageNet architectures are unnecessarily large for CheXpert by truncating final blocks from pretrained models, and find that we can make models 3.25x more parameter-efficient on average without a statistically significant drop in performance. Our work contributes new experimental evidence about the relation of ImageNet to chest x-ray interpretation performance.",38954732,2021-04-14T23:59:00.00,https://doi.org/10.1145/3450439.3451867
P12,CheXternal: Generalization of Deep Learning Models for Chest X-ray Interpretation to Photos of Chest X-rays and External Clinical Settings,"Pranav Rajpurkar, Anirudh Joshi, Anuj Pareek, Andrew Y. Ng, and Matthew P. Lungren (Stanford University)","Recent advances in training deep learning models have demonstrated the potential to provide accurate chest X-ray interpretation and increase access to radiology expertise. However, poor generalization due to data distribution shifts in clinical settings is a key barrier to implementation. In this study, we measured the diagnostic performance for 8 different chest X-ray models when applied to (1) smartphone photos of chest X-rays and (2) external datasets without any finetuning. All models were developed by different groups and submitted to the CheXpert challenge, and re-applied to test datasets without further tuning. We found that (1) on photos of chest X-rays, all 8 models experienced a statistically significant drop in task performance, but only 3 performed significantly worse than radiologists on average, and (2) on the external set, none of the models performed statistically significantly worse than radiologists, and five models performed statistically significantly better than radiologists. Our results demonstrate that some chest X-ray models, under clinically relevant distribution shifts, were comparable to radiologists while other models were not. Future work should investigate aspects of model training procedures and dataset collection that influence generalization in the presence of data distribution shifts.",38954733,2021-04-14T23:59:00.00,https://doi.org/10.1145/3450439.3451876
P13,Enabling Counterfactual Survival Analysis with Balanced Representations,"Paidamoyo Chapfuwa, Serge Assaad, Shuxi Zeng, Michael Pencina, Lawrence Carin, and Ricardo Henao (Duke University)","Balanced representation learning methods have been applied successfully to counterfactual inference from observational data. However, approaches that account for survival outcomes are relatively limited. Survival data are frequently encountered across diverse medical applications, \textit{i.e.}, drug development, risk profiling, and clinical trials, and such data are also relevant in fields like manufacturing (\textit{e.g.}, for equipment monitoring). When the outcome of interest is a time-to-event, special precautions for handling censored events need to be taken, as ignoring censored outcomes may lead to biased estimates. We propose a theoretically grounded unified framework for counterfactual inference applicable to survival outcomes. Further, we formulate a nonparametric hazard ratio metric for evaluating average and individualized treatment effects. Experimental results on real-world and semi-synthetic datasets, the latter of which we introduce, demonstrate that the proposed approach significantly outperforms competitive alternatives in both survival-outcome prediction and treatment-effect estimation.",38954734,2021-04-14T23:59:00.00,https://doi.org/10.1145/3450439.3451875
P14,Controlled Molecule Generator for Optimizing Multiple Chemical Properties,Bonggun Shin and Sungsoo Park (Deargen Inc.) | JinYeong Bak (SungKyunKwan University) | Joyce C. Ho (Emory University),"Generating a novel and optimized molecule with desired chemical properties is an essential part of the drug discovery process. Failure to meet one of the required properties can frequently lead to failure in a clinical test which is costly. In addition, optimizing these multiple properties is a challenging task because the optimization of one property is prone to changing other properties. In this paper, we pose this multi-property optimization problem as a sequence translation process and propose a new optimized molecule generator model based on the Transformer with two constraint networks: property prediction and similarity prediction. We further improve the model by incorporating score predictions from these constraint networks in a modified beam search algorithm. The experiments demonstrate that our proposed model outperforms state-of-the-art models by a significant margin for optimizing multiple properties simultaneously.",38954735,2021-04-14T23:59:00.00,https://doi.org/10.1145/3450439.3451879
P15,MetaPhys: Few-Shot Adaptation for Non-Contact Physiological Measurement,Xin Liu and Ziheng Jiang (University of Washington) | Josh Fromm (OctoML) | Xuhai Xu and Shwetak Patel (University of Washington) | Daniel McDuff (Microsoft Research),"There are large individual differences in physiological processes, making designing personalized health sensing algorithms challenging. Existing machine learning systems struggle to generalize well to unseen subjects or contexts and can often contain problematic biases. Video-based physiological measurement is not an exception. Therefore, learning personalized or customized models from a small number of unlabeled samples is very attractive as it would allow fast calibrations to improve generalization and help correct biases. In this paper, we present a novel meta-learning approach called MetaPhys for personalized video-based cardiac measurement. Our method uses only 18-seconds of video for customization and works effectively in both supervised and unsupervised manners. We evaluate our proposed approach on two benchmark datasets and demonstrate superior performance in cross-dataset evaluation with substantial reductions (42% to 44%) in errors compared with state-of-the-art approaches. We have also demonstrated our proposed method significantly helps reduce the bias in skin type.",38954736,2021-04-14T23:59:00.00,https://doi.org/10.1145/3450439.3451870
