UID,title,authors,abstract
21WS15,Interpretable Machine Learning Prediction of All-cause Mortality,"Wei Qiu, Hugh Chen, Ayse Berceste Dincer, and Su-In Lee (Paul G. Allen School of Computer Science and Engineering, University of Washington)","Explainable artificial intelligence provides an opportunity to improve prediction accuracy over standard linear models using 'black box' machine learning (ML) models while still revealing insights into a complex outcome such as all-cause mortality. We propose the IMPACT (Interpretable Machine learning Prediction of All-Cause morTality) framework that implements and explains complex, non-linear ML models in epidemiological research, by combining a tree ensemble mortality prediction model and an explainability method. We use 133 variables from NHANES 1999-2014 datasets (number of samples: ?? = 47, 261) to predict all-cause mortality. To explain our model, we extract local (i.e., per-sample) explanations to verify well-studied mortality risk factors, and make new dis- coveries. We present major factors for predicting ??-year mortality (?? = 1, 3, 5) across different age groups and their individualized im- pact on mortality prediction. Moreover, we highlight interactions between risk factors associated with mortality prediction, which leads to findings that linear models do not reveal. We demonstrate that compared with traditional linear models, tree-based models have unique strengths such as: (1) improving prediction power, (2) making no distribution assumptions, (3) capturing non-linear relationships and important thresholds, (4) identifying feature interactions, and (5) detecting different non-linear relationships between models. Given the popularity of complex ML models in prognostic research, combining these models with explainability methods has implications for further applications of ML in medical fields. To our knowledge, this is the first study that combines complex ML models and state-of-the-art feature attributions to explain mortality prediction, which enables us to achieve higher prediction accuracy and gain new insights into the effect of risk factors on mortality."
21WS16,Outcomes-Driven Clinical Phenotyping in Patients with Cardiogenic Shock for Risk Modeling and Comparative Treatment Effectiveness,Nathan C. Hurley (Texas A&M University); Alyssa Berkowitz (Yale University); Frederick Masoudi (University of Colorado School of Medicine); Joseph Ross and Nihar Desai (Yale University); Nilay Shah (Mayo Clinic); Sanket Dhruva (UCSF School of Medicine); Bobak J. Mortazavi (Texas A&M University),"Cardiogenic shock is a deadly and complicated illness. Despite extensive research into treating cardiogenic shock, mortality remains high and has not decreased over time. Patients suffering from cardiogenic shock are highly heterogeneous, and developing an understanding of phenotypes among these patients is crucial for understanding this disease and the appropriate treatments for individual patients. In this work, we develop a deep mixture of experts approach to jointly find phenotypes among patients with cardiogenic shock while simultaneously estimating their risk of in-hospital mortality. Although trained with information regarding treatment and outcomes, after training, the proposed model is decomposable into a network that clusters patients into phenotypes from information available prior to treatment. This model is validated on a synthetic dataset and then applied to a cohort of 28,304 patients with cardiogenic shock. The full model predicts in-hospital mortality on this cohort with an AUROC of 0.85 ± 0.01. The model discovers five phenotypes among the population, finding statistically different mortality rates among them and among treatment choices within those groups. This approach allows for grouping patients in clinical clusters with different rates of device utilization and different risk of mortality. This approach is suitable for jointly finding phenotypes within a clinical population and in modeling risk among that population."
21WS17,Multi-Objective Model-based Reinforcement Learning for Infectious Disease Control,"Runzhe Wan, Xinyu Zhang, and Rui Song (North Carolina State University)","Severe infectious diseases such as the novel coronavirus (COVID-19) pose a huge threat to public health. Stringent control measures, such as school closures and stay-at-home orders, while having significant effects, also bring huge economic losses. In the face of an emerging infectious disease, a crucial question for policymakers is how to make the trade-off and implement the appropriate interventions timely, with the existence of huge uncertainty. In this work, we propose a Multi-Objective Model-based Reinforcement Learning framework to facilitate data-driven decision making and minimize the long-term overall cost. Specifically, at each decision point, a Bayesian epidemiological model is first learned as the environment model, and then the proposed model-based multi-objective planning algorithm is applied to find a set of Pareto-optimal policies. This framework, combined with the prediction bands for each policy, provides a real-time decision support tool for policymakers. The application is demonstrated with the spread of COVID-19 in China."
21WS18,An Experimental Evaluation of Transformer-based LanguageModels in the Biomedical Domain,Paul Grouchi (Untether AI); Shobhit Jain (Manulife); Michael Liu (Tealbook); Kuhan Wang (CIBC); Max Tian (Adeptmind); Nidhi Arora (Intact); Hillary Ngai (University of Toronto); Faiza Khan Khattak (Manulife); Elham Dolatabadi and Sedef Akinli Kocak (Vector Institute),"With the growing amount of text in health data, there have beenrapid advances in large pre-trained models that can be applied to awide variety of biomedical tasks with minimal task-specific mod-ifications. Emphasizing the cost of these models, which renderstechnical replication challenging, this paper summarizes experi-ments conducted in replicating BioBERT and further pre-trainingand careful fine-tuning in the biomedical domain. We also inves-tigate the effectiveness of domain-specific and domain-agnosticpre-trained models across downstream biomedical NLP tasks. Ourfinding confirms that pre-trained models can be impactful in somedownstream NLP tasks (QA and NER) in the biomedical domain;however, this improvement may not justify the high cost of domain-specific pre-training."
21WS19,Knowledge Graph-based Question Answering with Electronic Health Records,Junwoo Park and Youngwoo Cho (Korea Advanced Institute of Science and Technology (KAIST)); Haneol Lee (Yonsei University); Jaegul Choo and Edward Choi (Korea Advanced Institute of Science and Technology (KAIST)),"Question Answering (QA) is a widely-used framework for developing and evaluating an intelligent machine. In this light, QA on Electronic Health Records (EHR), namely EHR QA, can work as a crucial milestone towards developing an intelligent agent in healthcare. EHR data are typically stored in a  relational database, which can also be converted to a directed acyclic graph, allowing two approaches for EHR QA: Table-based QA and Knowledge Graph-based QA. We hypothesize that the graph-based approach is more suitable for EHR QA as graphs can represent relations between entities and values more naturally compared to tables, which essentially require JOIN operations. In this paper, we propose a graph-based EHR QA where natural language queries are converted to SPARQL instead of SQL. To validate our hypothesis, we create four EHR QA datasets (graph-based VS table-based, and simplified database schema VS original database schema), based on a table-based dataset MIMICSQL. We test both a simple Seq2Seq model and a state-of-the-art EHR QA model on all datasets where the graph-based datasets facilitated up to 34% higher accuracy than the table-based dataset without any modification to the model architectures. Finally, all datasets will be open-sourced to encourage further EHR QA research in both directions."
21WS20,CATAN: Chart-aware temporal attention network for clinical text classification, Zelalem Gero and Joyce Ho (Emory University),"There is an increased adoption of electronic health record (EHR) systems by variety of hospitals and medical centers. This provides an opportunity to leverage automated computer systems in assisting healthcare workers. One of the least utilized but rich source of patient information is the unstructured clinical text. In this work, we develop \model, a chart-aware temporal attention network for learning patient representations from clinical notes. We introduce a novel representation where each note is considered a single unit, like a sentence, and composed of attention-weighted words. The notes in turn are aggregated into a patient representation using a second weighting unit, note attention. Unlike standard attention computations which focus only on the content of the note, we incorporate the chart-time for each note as a constraint for attention calculation. This allows our model to focus on notes closer to the prediction time. Using the MIMIC-III dataset, we empirically show that our patient representation and attention calculation achieves the best performance in comparison with various state-of-the-art baselines for one-year mortality prediction and 30-day hospital readmission. Moreover, the attention weights can be used to offer transparency into our model's predictions."
21WS21,Deep Cox Mixtures for Survival Regression,Chirag Nagpal (Carnegie Mellon University); Steve Yadlowsky; Negar Rostamzadeh; and Katherine Heller (Google Brain),"Survival analysis is a challenging variation of regression modeling because of the presence of censoring, where the outcome measurement is only partially known, due to, for example, loss to follow up. Such problems come up frequently in medical applications, making survival analysis a key endeavor in biostatistics and machine learning for healthcare, with Cox regression models being amongst the most commonly employed models. We describe a new approach for survival analysis regression models, based on learning mixtures of Cox regressions to model individual survival distributions. We propose an approximation to the Expectation Maximization algorithm for this model that does hard assignments to mixture groups to make optimization efficient. In each group assignment, we fit the hazard ratios within each group using deep neural networks, and the baseline hazard for each mixture component non-parametrically. We perform experiments on multiple real world datasets, and look at the mortality rates of patients across ethnicity and gender. We emphasize the importance of calibration in healthcare settings and demonstrate that our approach outperforms classical and modern survival analysis baselines, both in terms of discriminative performance and calibration, with large gains in performance on the minority demographics."
